event_name,category,start_month,start_day,start_year,end_month,end_day,end_year,start_time,end_time,content,location,revenue,starting price
Roger Jacoby: Pittsburgh Stories,Arts + Culture,Oct,25,2024,Jan,5.0,2025.0,,,"Wood Street Galleries is pleased to present the world premiere of three newly restored experimental films by Roger Jacoby (b. New York, 1944–1985), a pivotal figure bridging the pre- and post-liberation eras of gay experimental filmmaking.","601 Wood St, Pittsburgh, PA 15222",Wood Street Galleries,
Funny Girl,Arts + Culture,Jan,7,2025,Jan,12.0,2025.0,,,"Featuring one of the most iconic scores of all time by Jule Styne and Bob Merrill, an updated book from Harvey Fierstein based on the original classic by Isobel Lennart, tap choreography by Ayodele Casel, choreography by Ellenore Scott, and direction from Michael Mayer, this love letter to the theatre has the whole shebang!","7th St and Penn Ave, Pittsburgh, PA 15222",Benedum Center,
The Science Behind PIXAR,Family,May,25,2024,Jan,5.0,2025.0,,,"Step into the world of Pixar in this upcoming blockbuster exhibition with Woody, Buzz Lightyear, Mike and Sulley, Nemo and Dory, and all your favorite Pixar characters!","1 Allegheny Ave, Pittsburgh, PA 15212",Carnegie Science Center,
Kim Bond: We Are Not Alone,Arts + Culture,Sep,6,2024,Jan,12.0,2025.0,,,Kim Bond: We Are Not Alone is curated by Steph Neary & Anastasia James and presented by the Pittsburgh Cultural Trust. This exhibition is part of a series of exhibitions in collaboration with VaultArt Studio that promotes the inclusion of artists with disabilities in contemporary art.,"707 Penn Avenue, Pittsburgh, PA 15222",707 Gallery,
KANSAS,Music,Dec,11,2024,Dec,11.0,2024.0,7:30 pm,10:00 pm,50th Anniversary Tour - Another Fork in the Road,"7th St and Penn Ave, Pittsburgh, PA 15222",Benedum Center,
Lit Friday,Arts + Culture,Dec,13,2024,Dec,13.0,2024.0,6:00 pm,7:00 pm,"Lit Fridays is a literary-focused, virtual salon presented by the August Wilson African American Cultural Center",,Virtual Event,
MJ the Musical,Arts + Culture,Nov,19,2024,Dec,1.0,2024.0,,,"He is one of the greatest entertainers of all time. Now, Michael Jackson’s unique and unparalleled artistry comes to Pittsburgh as MJ, the multi Tony Award®-winning new musical centered around the making of the 1992 Dangerous World Tour, begins a tour of its own.","7th St and Penn Ave, Pittsburgh, PA 15222",Benedum Center,
Storytime Spotlight,Arts + Culture,Dec,17,2024,Dec,17.0,2024.0,6:30 pm,7:30 pm,"Storytime Spotlight is an educational series presented by the August Wilson African American Cultural Center that introduces young children to books that features stories, songs, rhymes, and fingerplays.",,Virtual Event,
AWCommunity Day,Community,Dec,14,2024,Dec,14.0,2024.0,12:00 pm,4:00 pm,"This free family-friendly event features local vendors, artisans, performers, and themed community building activations at the August Wilson African American Cultural Center",,August Wilson African American Cultural Center,
The Hobbit,Arts + Culture,Oct,23,2024,Nov,10.0,2024.0,,,"In this all-ages adventure, J.R.R. Tolkien’s magical Middle Earth transitions from page to stage in spellbinding fashion.","621 Penn Ave, Pittsburgh, PA 15222",O'Reilly Theater,
Justin Timberlake,Music,Dec,14,2024,Dec,14.0,2024.0,7:30 pm,11:00 pm,The Forget Tomorrow World Tour,"1001 Fifth Ave, Pittsburgh, PA 15219",PPG Paints Arena,
Miguel Muñoz in What is Magic for You?,Entertainment,Oct,2,2024,Nov,3.0,2024.0,,,"Miguel Muñoz, World Champion of Magic brings us an intimate and magical show where the surprise, the impossible, the poetry and the absurd will be present at all times.","811 Liberty Ave, Pittsburgh, PA 15222",Liberty Magic,
History Center and Fort Pitt Museum: Free Admission for Kids,Community,Oct,1,2024,Nov,30.0,2024.0,,,"The Smithsonian-affiliated Senator John Heinz History Center and Fort Pitt Museum will offer free admission for kids this fall, thanks to the generous support of UPMC and UPMC Health Plan.","1212 Smallman St, Pittsburgh, PA 15222",Heinz History Center,
&amp; Juliet,Arts + Culture,Oct,29,2024,Nov,3.0,2024.0,,,"Created by the Emmy®-winning writer from “Schitt’s Creek,” this hilarious new musical flips the script on the greatest love story ever told.","7th St and Penn Ave, Pittsburgh, PA 15222",Benedum Center,
Iron Maiden,Music,Nov,8,2024,Nov,8.0,2024.0,7:30 pm,10:30 pm,The Future Past World Tour 2024,"1001 Fifth Ave, Pittsburgh, PA 15219",PPG Paints Arena,
American Society of Microbiology - Annual Biomedical Research Conference for Minority Students,Convention,Nov,14,2024,Nov,16.0,2024.0,,,"The Annual Biomedical Research Conference for Minority Students (ABRCMS) aims at promoting the underrepresented minorities in technology, science, engineering and mathematics and provides students with a unique opportunity to showcase their research, activities which are designed to enhance their professional development skills and networking activities.","1000 Fort Dusquene Boulevard, Pittsburgh, PA 15222",David L. Lawrence Convention Center,
Build On,Convention,Nov,2,2024,Nov,3.0,2024.0,,,"You cannot afford to miss “BUILD ON”, an event geared towards students in 7th - 12th grade and designed to facilitate a wide array of career development opportunities.","1000 Fort Dusquene Boulevard, Pittsburgh, PA 15222",David L. Lawrence Convention Center,
SkyWatch,Nightlife,Nov,16,2024,Nov,16.0,2024.0,7:00 pm,9:00 pm,"Guests are invited to reconnect with the night sky through a featured planetarium performance and, weather-permitting, live views of night sky objects in stunning telescopic detail.","1 Allegheny Ave, Pittsburgh, PA 15212",Carnegie Science Center,
Cavalleria Rusticana and Pagliacci,Arts + Culture,Nov,9,2024,Nov,17.0,2024.0,,,"Jealousy, two-timing, and revenge unite the back-to-back tragedies of Cavalleria Rusticana and Pagliacci. Possessiveness, machismo, and rage fuel their bloody conclusions.This is the first time Pittsburgh Opera has performed this back-to-back double feature of love and hate together since 1996!","2425 Liberty Ave, Pittsburgh, PA 15222",Pittsburgh Opera,
Jim Gaffigan,Entertainment,Nov,9,2024,Nov,9.0,2024.0,7:00 pm,10:00 pm,Barely Alive Tour,"1001 Fifth Ave, Pittsburgh, PA 15219",PPG Paints Arena,
Visit the Old Allegheny County Jail and Museum,Tours,Nov,4,2024,Nov,4.0,2024.0,11:30 am,1:00 pm,Take a free trip!,"440 Ross St, Pittsburgh, PA 15219",Old Allegheny County Jail Museum,
Visit the Old Allegheny County Jail and Museum,Tours,Nov,18,2024,Nov,18.0,2024.0,11:30 am,1:00 pm,Take a free trip!,"440 Ross St, Pittsburgh, PA 15219",Old Allegheny County Jail Museum,
Eagle Fall Show Pittsburgh 2024,Shopping,Nov,23,2024,Nov,24.0,2024.0,,,"The Eagle Fall Show brings together patriots and enthusiasts eager to trade, buy and sell the best selection of guns, gear, equipment and ammunition.","1000 Fort Dusquene Boulevard, Pittsburgh, PA 15222",David L. Lawrence Convention Center,
Penguins vs. Ducks,Sports + Recreation,Oct,31,2024,Oct,31.0,2024.0,7:00 pm,10:00 pm,Come cheer on the Penguins as they take on the Ducks at PPG Paints Arena!,"1001 Fifth Ave, Pittsburgh, PA 15219",PPG Paints Arena,
SkyWatch,Nightlife,Oct,26,2024,Oct,26.0,2024.0,9:00 pm,11:00 pm,"Guests are invited to reconnect with the night sky through a featured planetarium performance and, weather-permitting, live views of night sky objects in stunning telescopic detail.","1 Allegheny Ave, Pittsburgh, PA 15212",Carnegie Science Center,
Faces of Resilience Workshops,Community,Oct,26,2024,Oct,27.0,2024.0,,,"Are you a survivor of gun violence, or do you know someone who is? Join us for Faces of Resilience, a transformative two-day workshop at the August Wilson African American Cultural Center, where you’ll create powerful masks to express your emotions, celebrate your loved ones, and honor your triumphs.","980 Liberty Ave, Pittsburgh, PA 15222",The August Wilson African American Cultural Center,
Gems of Pittsburgh Tour,Outdoor,Oct,26,2024,Oct,26.0,2024.0,3:00 pm,6:00 pm,This tour is designed for first-time visitors as well as those who are already familiar with Pittsburgh.,,Bike the Burgh Tours,
Bikes &amp; Brews Tour,Outdoor,Oct,26,2024,Oct,26.0,2024.0,2:00 pm,5:30 pm,"Join us on a ride around the historic districts of Deutschtown, Millvale, and Lawrenceville as we visit 4 of our favorite local breweries and learn about the past, present, and future of beer making in Pittsburgh, with an emphasis on how beer figures in the diverse communities of the Steel City.",,Bike the Burgh Tours,
Dandy Andy: Warhol’s Queer History,Arts + Culture,Oct,26,2024,Oct,26.0,2024.0,3:00 pm,6:00 pm,"Join artist educators for Dandy Andy, a monthly tour that focuses on Warhol’s queer history.","117 Sandusky St, Pittsburgh, PA 15212",The Andy Warhol Museum,
Juvenile Arthritis Family Fun Day,Community,Oct,26,2024,Oct,26.0,2024.0,10:00 am,12:00 pm,,"1 Allegheny Avenue, Pittsburgh, PA 15212",Carnegie Science Center,
Mod Sun &amp; lovelytheband: Here’s Your Flowers Tour,Entertainment,Oct,27,2024,Oct,27.0,2024.0,6:00 pm,10:00 pm,With special guests Huddy and No Love For The Middle Child!,"400 N Shore Dr, Pittsburgh, PA 15212",Stage AE,
Lucky Draw,Entertainment,Oct,27,2024,Oct,27.0,2024.0,7:30 pm,9:30 pm,"Arcade Comedy Theater presents “Lucky Draw” an improv comedy show where half of the cast is drawn at random! Each show, Arcade Academy students and team members drop their names into box at the start of the night. Throughout the evening, the hosts will be playing short form games and doing a long-form set that mixes up these performers alongside special guests, teachers, and coaches from the Arcade community.","943 Liberty Ave, Pittsburgh, PA 15222",Arcade Comedy Theater,
Homefront and Frontlines: Women and the Impact of War,Community,Oct,27,2024,Oct,27.0,2024.0,2:00 pm,4:00 pm,"Join the History Center and the Veterans Breakfast Club for a storytelling event honoring the strength and sacrifice of women during war time, from the battlefield to the home front.","1212 Smallman St, Pittsburgh, PA 15222",Heinz History Center,
Peter Pan,Arts + Culture,Oct,27,2024,Oct,27.0,2024.0,2:00 pm,5:00 pm,"Escape to Neverland for a daring adventure with Wendy, John, Michael, Tinkerbell and Peter in the ever-playful Peter Pan.","7th St and Penn Ave, Pittsburgh, PA 15222",Benedum Center,
NACADA's 2024 Annual Conference,Convention,Oct,27,2024,Oct,30.0,2024.0,,,NACADA promotes and supports quality academic advising in institutions of higher education to enhance the educational development of students.,"1000 Fort Duquesne Blvd, Pittsburgh, PA 15222",David L. Lawrence Convention Center,
Steelers Tailgate,Outdoor,Oct,28,2024,Oct,28.0,2024.0,4:00 pm,8:00 pm,"Stage AE is the Official host of the Pittsburgh Steelers Tailgates. Open before every home game at Acrisure Stadium, the region’s largest tailgate event offers free admission, live music, food and drink specials and the chance to win prizes and autographed items.","400 N Shore Dr, Pittsburgh, PA 15212",Stage AE,
Lucky Draw,Entertainment,Oct,27,2024,Oct,27.0,2024.0,7:30 pm,8:30 pm,Arcade Comedy Theater presents “Lucky Draw” an improv comedy show where half of the cast is drawn at random!,"943 Liberty Ave, Pittsburgh, PA 15222",Arcade Comedy Theater,
Harry Potter and the Order of the Phoenix™ in Concert,Entertainment,Oct,27,2024,Oct,27.0,2024.0,2:30 pm,6:30 pm,Experience your favorite movies transformed with the music of a live symphony orchestra in the Harry Potter™ Film Concert Series.?,"600 Penn Ave, Pittsburgh, PA 15222",Heinz Hall,
Black &amp; Gold Tour,Tours,Oct,27,2024,Oct,27.0,2024.0,3:00 pm,4:30 pm,"Hop aboard and see the Steel City like never before on this one-of-a-kind, tailgate style tour… only in THE BURGH!","2101 Smallman St, Pittsburgh, PA 15222",Boarding,
Tri-Anglers Lunchtime Fishing,Outdoor,May,8,2024,Oct,2.0,2024.0,,,"Join us for Tri-Anglers, a free fishing program that has been running for over 22 years in downtown Pittsburgh! We catch and release a variety species of fish along the Allegheny River – bass, carp, catfish, freshwater drum, and more! No prior fishing experience needed and great activity for all ages.","Pittsburgh, PA",North Shore Riverwalk by the Water Steps Near PNC Park,
Visit the Old Allegheny County Jail and Museum,Free event,Oct,21,2024,Oct,21.0,2024.0,11:30 am,1:00 pm,,"440 Ross Street, Pittsburgh, PA 15219",The Jail Museum,
North American Caterpillar Dealers Procurement &amp; Fleet Group - 2024 NACDPGF Conference,Convention,Sep,30,2024,Oct,4.0,2024.0,,,The 2024 NACD Procurement and Fleet Group Conference is geared towards procurement and fleet professionals for the Caterpillar dealers in North America.,"1000 Fort Dusquene Boulevard, Pittsburgh, PA 15222",David L. Lawrence Convention Center,
A Woman's Place: How Women Shaped Pittsburgh,Arts + Culture,Mar,23,2024,Oct,6.0,2024.0,,,"From pioneering investigative journalism to leading their country to Olympic gold, Western Pennsylvania women have made an immeasurable impact in America, but too often, their stories have been overlooked.","1212 Smallman Street, Pittsburgh, PA 15222",Heinz History Center,
Penguins vs. Red Wings,Sports + Recreation,Oct,1,2024,Oct,1.0,2024.0,7:00 pm,10:00 pm,Come cheer on the Penguins as they take on the Red Wings at PPG Paints Arena!,"1001 Fifth Ave, Pittsburgh, PA 15219",PPG Paints Arena,
The Substance,Arts + Culture,Sep,20,2024,Oct,3.0,2024.0,,,Demi Moore portrays a fading Hollywood star feuding with the manifestation of her younger self (Margaret Qualley) in this award-winning body-horror satire from writer-director Coralie Fargeat (Revenge).,"809 Liberty Ave, Pittsburgh, PA 15222",Harris Theater,
Library Lounge: Movie Matinee,Community,Oct,1,2024,Oct,1.0,2024.0,12:00 pm,3:00 pm,Join us for a movie screening of The Fall Guy.,"612 Smithfield St, Pittsburgh, PA 15222",Carnegie Library of Pittsburgh Downtown,
Lake Street Dive: Good Together Tour,Music,Oct,1,2024,Oct,1.0,2024.0,6:30 pm,11:00 pm,,"400 N Shore Dr, Pittsburgh, PA 15222",Stage AE,
Gold Over America Tour,Entertainment,Oct,2,2024,Oct,2.0,2024.0,7:30 pm,10:30 pm,"Join the excitement at the Athleta Presents Gold Over America Tour, starring Simone Biles and America’s best gymnasts. This celebration of world-class gymnastics is designed to inspire the next generation of champions.","1001 Fifth Ave, Pittsburgh, PA 15219",PPG Paints Arena,
Pittsburgh Silent Film Festival: Michael (1924),Arts + Culture,Oct,2,2024,Oct,2.0,2024.0,7:30 pm,9:30 pm,"Featuring live piano accompaniment, Danish film master Carl Theodor Dreyer’s masterpiece MICHAEL is an unusually sensitive, decorous work of art and one of the earliest, most compassionate overtly gay-themed films in movie history.","809 Liberty Ave, Pittsburgh, PA 15222",Harris Theater,
Sh!tFaced Shakespeare: Much Ado About Nothing,Entertainment,Oct,2,2024,Oct,13.0,2024.0,,,"The smash-hit, internationally acclaimed, award-winning, multi sell-out fringe phenomenon is coming to the Greer Cabaret Theater with their version of Much Ado About Nothing.","655 Penn Ave, Pittsburgh, PA 15222",Greer Cabaret Theater,
Stand Up 101 Class Show,Arts + Culture,Oct,3,2024,Oct,3.0,2024.0,7:00 pm,8:00 pm,Come see Arcade Comedy Theater’s newest stand up comics debut the material they developed in our 8-week Stand Up 101 class!,"943 Liberty Ave, Pittsburgh, PA 15222",Arcade Comedy Theater,
Improv 301 Class Show,Arts + Culture,Oct,3,2024,Oct,3.0,2024.0,8:30 pm,10:00 pm,Come see Arcade Comedy Theater’s rising stars take the stage to show off what they have learned in their Improv 301: The Harold class show!,"943 Liberty Ave, Pittsburgh, PA 15222",Arcade Comedy Theater,
Flamenco Pittsburgh presents Sobre Las Olas,Arts + Culture,Oct,3,2024,Oct,3.0,2024.0,8:00 pm,9:30 pm,"Join Flamenco Pittsburgh as they celebrate their recent incorporation as a non-profit with this film that explores the importation of flamenco music into America, and the artists who keep this tradition of song, dance, and poetry alive.","809 Liberty Ave, Pittsburgh, PA 15222",Harris Theater,
2024 Oktoberfest Pittsburgh,Festival,Oct,3,2024,Oct,13.0,2024.0,,,"Throughout this 11-day festival, Market Square will be transformed into a Karneval and Biergarten with activities for everyone, including Feats of Strength competitions, live music, a KinderPlay family area, and more!","Pittsburgh, PA 15222",Market Square,
House Team Hot Spot,Arts + Culture,Oct,4,2024,Oct,4.0,2024.0,7:00 pm,9:00 pm,"Ignite your Friday nights at 7 pm with Arcade Comedy Theater’s House Team Hot Spot! Our talented house teams will light up the stage with spontaneous hilarity, quick-witted banter, and scenes that are sure to leave you in stitches.","943 Liberty Ave, Pittsburgh, PA 15222",Arcade Comedy Theater,
Penguins vs. Blue Jackets,Sports + Recreation,Oct,4,2024,Oct,4.0,2024.0,7:00 pm,10:00 pm,Come cheer on the Penguins as they take on the Blue Jackets at PPG Paints Arena!,"1001 Fifth Ave, Pittsburgh, PA 15219",PPG Paints Arena,
The Stand Up Laboratory,Entertainment,Oct,4,2024,Oct,4.0,2024.0,9:00 pm,10:30 pm,"The Stand-Up Laboratory is a new incubator space presented by Arcade Comedy Theater. Every month, the Lab will present a mix of feature comics and a roster of comedians chosen from online submissions. Enjoy a night of comedy highlighting newer material from Pittsburgh’s best comedians and its rising stars.","943 Liberty Ave, Pittsburgh, PA 15222",Arcade Comedy Theater,
Let's Speak English!,Community,Oct,4,2024,Oct,4.0,2024.0,12:00 pm,1:00 pm,"This is a relaxed, social discussion group where participants can freely practice their English-speaking skills with friendly neighbors. For English language learners looking to practice with other learners.","612 Smithfield St, Pittsburgh, PA 15222",Carnegie Library of Pittsburgh Downtown,
Level Up Stand Up,Entertainment,Oct,5,2024,Oct,5.0,2024.0,9:00 pm,11:00 pm,"Each month, see a new lineup of some of Pittsburgh’s best comics alongside up-and-coming and touring guests. BYOB or grab a drink from our bar, and get ready for a fun and affordable night of comedy in the Cultural District.","943 Liberty Ave, Pittsburgh, PA 15222",Arcade Comedy Theater,
Bone Bash Gala Hosted by the Arthritis Foundation,Community,Oct,4,2024,Oct,4.0,2024.0,6:00 pm,11:00 pm,,"600 Commonwealth Place, Pittsburgh, PA 15222",Wyndham Grand Pittsburgh Downtown,
The Forest Hills,Arts + Culture,Oct,4,2024,Oct,8.0,2024.0,,,"Rico, played by the enigmatic Chiko Mendez, longs to be understood and is tormented by a series of visions after a head injury in the Catskill Mountains. Also starring Edward Furlong and Shelley Duvall.","809 Liberty Ave, Pittsburgh, PA 15222",Harris Theater,
The Porch Party,Entertainment,Oct,5,2024,Oct,5.0,2024.0,6:00 pm,8:00 pm,"An informal and intimate evening of song, laughter, and real human connection for all ages.","943 Liberty Ave, Pittsburgh, PA 15222",Arcade Comedy Theater,
Irony City,Entertainment,Oct,5,2024,Oct,5.0,2024.0,8:00 pm,10:00 pm,Join veteran comedy troupe Irony City as they deftly navigate social missteps on the first Saturday each month.,"943 Liberty Ave, Pittsburgh, PA 15222",Arcade Comedy Theater,
Heritage Kitchen: Yugoslav Food,Arts + Culture,Oct,5,2024,Oct,5.0,2024.0,11:00 am,12:00 pm,Join the History Center for a taste of Yugoslav food traditions and immerse yourself in our region’s culinary culture!,"1212 Smallman St, Pittsburgh, PA 15222",Heinz History Center,
Negativland Documentary and Live Performance,Arts + Culture,Oct,5,2024,Oct,5.0,2024.0,7:00 pm,9:00 pm,"Delight in a screening of STAND BY FOR FAILURE: A DOCUMENTARY ABOUT NEGATIVLAND directed by Ryan Worsley. After, experience a live performance by Negativland in WE CAN REALLY FEEL LIKE WE’RE HERE, accompanied by SUE-C’s unique and immersive visuals.","809 Liberty Ave, Pittsburgh, PA 15222",Harris Theater,
TOSCA,Arts + Culture,Oct,5,2024,Oct,5.0,2024.0,8:00 pm,11:00 pm,"Puccini’s whirlwind political thriller packs high romance, dark motives, love, betrayal, murder, and intrigue all into a plot that unfolds over only 24 hours. See why Tosca is one of the most powerful operas ever written.","237 7th St, Pittsburgh, PA 15222",Benedum Center,
Gems of Pittsburgh Tour,Outdoor,Oct,5,2024,Oct,5.0,2024.0,3:00 pm,6:00 pm,This tour is designed for first-time visitors as well as those who are already familiar with Pittsburgh.,,Bike the Burgh Tours,
AWCommunity Day,Community,Oct,5,2024,Oct,5.0,2024.0,12:00 pm,4:00 pm,"This free family-friendly event features local vendors, artisans, performers, and themed community building activations at the August Wilson African American Cultural Center.","980 Liberty Ave, Pittsburgh, PA 15222",August Wilson African American Cultural Center,
Jelly Roll,Music,Oct,5,2024,Oct,5.0,2024.0,7:00 pm,11:00 pm,The Beautifully Broken Tour,"1001 Fifth Ave, Pittsburgh, PA 15219",PPG Paints Arena,
Steelers Tailgate,Entertainment,Oct,6,2024,Oct,6.0,2024.0,4:30 pm,8:30 pm,"Stage AE is the Official host of the Pittsburgh Steelers Tailgates. Open before every home game at Acrisure Stadium, the region’s largest tailgate event offers free admission, live music, food and drink specials and the chance to win prizes and autographed items.","400 N Shore Dr, Pittsburgh, PA 15212",Stage AE,
Matteo Lane: Can't Stop Talking,Entertainment,Oct,6,2024,Oct,6.0,2024.0,7:30 pm,10:30 pm,MATTEO LANE is a New York-based comedian whose stand-up special can be seen on Netflix’s THE COMEDY LINEUP.,"101 6th St, Pittsburgh, PA 15222",Byham Theater,
Your ACT with Nonsense,Entertainment,Oct,6,2024,Oct,6.0,2024.0,7:30 pm,9:30 pm,"Tonight, the A.C.T. stage is yours! Bring your improv teams, sketch group, or stand-up act for an open mic-style show where the lineup is created on the spot. A perfect opportunity for artists to try something new in a short set and for audiences to see some experimental and cutting edge comedy.","943 Liberty Ave, Pittsburgh, PA 15222",Arcade Comedy Theater,
Pittsburgh Architecture Week,Community,Oct,7,2024,Oct,11.0,2024.0,,,"Pittsburgh Architecture Week shares how architects – and all who design and build our spaces and places – create our built environment, how architecture impacts everyone’s daily lives, and highlights our region’s unique architectural identity.",,Downtown Pittsburgh,
The Materials Science &amp; Technology 2024 Annual Conference,Convention,Oct,6,2024,Oct,10.0,2024.0,,,The Materials Science and Technology Conference is a must-attend event for those in the material science industry.,"1000 Fort Dusquene Boulevard, Pittsburgh, PA 15222",David L. Lawrence Convention Center,
Pittsburgh Silent Film Festival: Two by Buster Keaton!,Arts + Culture,Oct,6,2024,Oct,6.0,2024.0,5:00 pm,7:00 pm,"The Pittsburgh Silent Film Festival returns for a very special centenary double bill screening of two films from one of the all-time great filmmakers and performers, Buster Keaton, accompanied by a two truly one-of-a-kind musical performances.","809 Liberty Ave, Pittsburgh, PA 15222",Harris Theater,
Pop Generation: Senior Social,Arts + Culture,Oct,7,2024,Oct,7.0,2024.0,9:00 am,12:00 pm,"Pop Generation: Senior Social is a series of events exclusively presented for adults ages 65 and over. Throughout the year, older adults can join our staff for lectures, artmaking activities, and gallery talks that utilize our one of a kind collection and special exhibitions.","117 Sandusky St, Pittsburgh, PA 15212",The Andy Warhol Museum,
Stevie Wonder,Entertainment,Oct,8,2024,Oct,8.0,2024.0,8:00 pm,11:00 pm,Sing Your Song! As We Fix Our Nation's Broken Heart,"1001 Fifth Ave, Pittsburgh, PA 15219",PPG Paints Arena,
Fall Dance Concert,Arts + Culture,Oct,9,2024,Oct,13.0,2024.0,,,"The Conservatory Dance Company presents a concert featuring works by Jimmy Gamonet de los Heros, Roni Koresh, Juel Lane, and Kevin and Marcel Wilson.","350 Forbes Ave, Pittsburgh, PA 15222",PNC Theatre,
TOSCA,Arts + Culture,Oct,8,2024,Oct,8.0,2024.0,7:00 pm,10:00 pm,"Puccini’s whirlwind political thriller packs high romance, dark motives, love, betrayal, murder, and intrigue all into a plot that unfolds over only 24 hours. See why Tosca is one of the most powerful operas ever written.","237 7th St, Pittsburgh, PA 15222",Benedum Center,
"MrBallen: The Strange, Dark, &amp; Mysterious Live Tour",Entertainment,Oct,9,2024,Oct,9.0,2024.0,8:00 pm,11:00 pm,"MrBallen, the top true crime podcast host and one of the internet’s biggest storytellers, presents his first ever live tour, where he will take the audience on an immersive adventure through some of his most chilling Strange, Dark & Mysterious Tales.","101 6th St, Pittsburgh, PA 15222",Byham Theater,
Daytime Revolution,Arts + Culture,Oct,9,2024,Oct,9.0,2024.0,8:00 pm,10:00 pm,"Beatles fans and TV history buffs, join us for a one-night-only screening of the documentary DAYTIME REVOLUTION. Come learn about the five unforgettable episodes of televsion that aired in 1972 with John Lennon and Yoko Ono at the helm.","809 Liberty Ave, Pittsburgh, PA 15222",Harris Theater,
Three Rivers Readers Book Club,Community,Oct,9,2024,Oct,9.0,2024.0,12:00 pm,1:00 pm,The Three Rivers Readers is designed to explore the role Pittsburgh plays in our collective literary culture.,"612 Smithfield St, Pittsburgh, PA 15222",Carnegie Library of Pittsburgh Downtown,
Penguins vs. Rangers,Sports + Recreation,Oct,9,2024,Oct,9.0,2024.0,7:30 pm,10:30 pm,Come cheer on the Penguins as they take on the Rangers at PPG Paints Arena!,"1001 Fifth Ave, Pittsburgh, PA 15219",PPG Paints Arena,
BBQ Lock And Dam Dinner Cruise &amp; Tour,Tours,Oct,10,2024,Oct,10.0,2024.0,6:00 pm,9:30 pm,"Come aboard a classic Pittsburgh dining and sightseeing cruise that is fun and exciting for the entire family! Enjoy an ALL-NEW MENU, passage through a Lock and Dam, music, and the beautiful sights of the Three Rivers!","350 West Station Square Dr, Pittsburgh, PA 15219",Gateway Clipper Fleet Docks,
