event_name,category,start_month,start_day,start_year,end_month,end_day,end_year,start_time,end_time,content,location,revenue,starting price
Nadcap,Convention,Oct,21,2024,Oct,24.0,2024.0,,,"Nadcap is the premier program for accrediting critical processes in the aerospace and defense industries, Nadcap focuses on standardizing approaches to quality assurance and promoting continuous improvement.  This program is essential for suppliers seeking to demonstrate their commitment to excellence.","530 William Penn Pl, Pittsburgh, PA 15219",Omni William Penn Hotel,
Escher Quartet with Jordan Bak,Arts + Culture,Oct,21,2024,Oct,21.0,2024.0,7:30 pm,10:30 pm,"A powerful collaboration between Bak’s “haunting lyrical grace” (Gramophone) and the Escher Quartet’s “eloquent, full-blooded playing” (BBC Music Magazine)","350 Forbes Ave, Pittsburgh, PA 15222",PNC Theatre,
Visit the Old Allegheny County Jail and Museum,Tours,Oct,21,2024,Oct,21.0,2024.0,11:30 am,1:00 pm,Take a free trip!,"440 Ross St, Pittsburgh, PA 15219",Old Allegheny County Jail Museum,
Eradicate Hate Global Summit 2024,Convention,Oct,21,2024,Oct,23.0,2024.0,,,"Eradicate Hate Global Summit is the world’s largest anti-hate conference, which brings together leaders and experts from around to globe in a common effort to shape strategies and programs designed to eradicated hate-fueled violence.","1000 Fort Dusquene Boulevard, Pittsburgh, PA 15222",David L. Lawrence Convention Center,
Game Changers: Women and Sport,Family,Oct,22,2024,Oct,22.0,2024.0,6:00 pm,7:30 pm,"Celebrate the past, present, and future of women in sports!","1212 Smallman St, Pittsburgh, PA 15222",Heinz History Center,
Educator Open House,Community,Oct,23,2024,Oct,23.0,2024.0,5:30 pm,8:30 pm,"Educators, join the History Center for an evening celebrating YOU!","1212 Smallman St, Pittsburgh, PA 15222",Heinz History Center,
Ken Carson: Chaos Tour,Entertainment,Oct,22,2024,Oct,22.0,2024.0,7:00 pm,11:00 pm,Come see Ken Carson live at Stage AE for the Chaos Tour!,"400 N Shore Dr, Pittsburgh, PA 15212",Stage AE,
Union,Arts + Culture,Oct,23,2024,Oct,23.0,2024.0,8:00 pm,10:00 pm,"Up against one of the most powerful companies on the planet, a group of Amazon workers embark on an unprecedented campaign to unionize their warehouse in Staten Island, New York.","809 Liberty Ave, Pittsburgh, PA 15222",Harris Theater,
International Colloquium on Black Males in Education (ICBME),Convention,Oct,23,2024,Oct,23.0,2024.0,9:00 am,1:30 pm,"2024 ICBME Theme: ""Confronting Trauma in Education and Beyond: Charting a Pathway Forward for Black Men and Boys""","745 Grant St, Pittsburgh, PA 15219",Drury Plaza Hotel Pittsburgh Downtown,
Taekwondo 2024 Fall Nationals,Convention,Oct,23,2024,Oct,26.0,2024.0,,,"The American Taekwondo Association (ATA) is excited be in Pittsburgh for the 2024 Fall Nationals, Oct. 23-26 at the David L. Lawrence Convention Center. This is the third consecutive year ATA has held this event in Pittsburgh!",,David L. Lawrence Convention Center & The Westin Pittsburgh,
Disenchanted!,Arts + Culture,Oct,24,2024,Oct,24.0,2024.0,7:30 pm,11:00 pm,Poisoned apples. Glass slippers. Who needs ’em?! Not Snow White and her posse of disenchanted princesses in the hilarious hit musical that’s anything but Grimm.,"101 6th St, Pittsburgh, PA 15222",Byham Theater,
Mitchell Tenpenny: Woke Up In A Dream Tour,Entertainment,Oct,24,2024,Oct,24.0,2024.0,7:00 pm,11:00 pm,With special guest Dylan Schneider!,"400 N Shore Dr, Pittsburgh, PA 15212",Stage AE,
Nosferatu: A Symphony of Horror (1922) with live score by Tom Roberts,Arts + Culture,Oct,24,2024,Oct,24.0,2024.0,8:00 pm,10:00 pm,"A genre-defining film for the ages, Nosferatu returns to the Harris Theater with Tom Roberts performing his own original score live.","809 Liberty Ave, Pittsburgh, PA 15222",Harris Theater,
Pour Me Another - St. George Spirits Dinner,Community,Oct,24,2024,Oct,24.0,2024.0,6:30 pm,8:30 pm,Get ready to raise your glass and enjoy a night of great food and drinks at Pour Me Another - October 2024!,"107 6th St, Pittsburgh, PA 15222",Renaissance Pittsburgh Hotel,
Pitt Panthers vs. Syracuse Orange,Entertainment,Oct,24,2024,Oct,24.0,2024.0,7:30 pm,10:30 pm,The Pitt Panthers take on Syracuse Orange in 2024 NCAA Football action at Acrisure Stadium.,"100 Art Rooney Ave, Pittsburgh, PA 15212",Acrisure Stadium,
Ofrenda Happy Hour,Arts + Culture,Oct,24,2024,Oct,24.0,2024.0,6:00 pm,9:00 pm,Kick off the Día de los Muertos festivities with Pittsburgh Metropolitan Area Hispanic Chamber of Commerce at the Ofrenda Happy Hour!,"655 Penn Ave, Pittsburgh, PA 15222",Greer Cabaret Theater,
Disney on Ice presents Frozen &amp; Encanto,Entertainment,Oct,24,2024,Oct,27.0,2024.0,,,Check showtimes!,"1001 Fifth Ave, Pittsburgh, PA 15219",PPG Paints Arena,
Music of Led Zeppelin,Arts + Culture,Oct,24,2024,Oct,24.0,2024.0,7:30 pm,10:30 pm,"Bridging the gulf between rock n’ roll and classical music, the Pittsburgh Symphony Orchestra performs The Music of Led Zeppelin.","600 Penn Ave, Pittsburgh, PA 15222",Heinz Hall,
Halloween Boogie Bash,Holidays,Oct,25,2024,Oct,25.0,2024.0,6:30 pm,9:30 pm,Show off your spooky dance moves at our Halloween Boogie Bash! Dance the night away to thrilling beats and show off your costume for a chance to win wicked prizes. Enjoy themed drinks and delectable hors d'oeuvres while you mix and mingle with your ghoulfriends.,"301 Grant St Ste 411, Pittsburgh, PA 15219",Rivers Club,
Select Start,Entertainment,Oct,25,2024,Oct,25.0,2024.0,9:00 pm,11:00 pm,"Cultural District creative, Mr. Arcade, was found dead in the theater last week. To help figure out what calamity occurred, spiritual medium improv team, Select Start, will be called in to contact his ghost live to solve this recent murder. However… Select Start does stand to gain a lot from the death of Mr. Arcade. Perhaps… foul play has occurred? Come on down to find out and help us to solve this Murder Mystery! It will be an improv show to die for.","943 Liberty Ave, Pittsburgh, PA 15222",Arcade Comedy Theater,
House Team Hot Spot,Entertainment,Oct,25,2024,Oct,25.0,2024.0,7:00 pm,9:00 pm,"Ignite your Friday nights at 7 pm with Arcade Comedy Theater’s House Team Hot Spot! Our talented house teams will light up the stage with spontaneous hilarity, quick-witted banter, and scenes that are sure to leave you in stitches. Come see why these performers are the heartbeat of Pittsburgh’s comedy scene as they turn your wild suggestions into unforgettable moments of pure comedic gold.  Don’t miss out on the laughs—grab your tickets now and fill your Friday with fiery fun!","943 Liberty Ave, Pittsburgh, PA 15222",Arcade Comedy Theater,
GALLERY CRAWL,Entertainment,Oct,25,2024,Oct,25.0,2024.0,6:00 pm,8:00 pm,"Get ready for a night of non-stop laughter at Arcade Comedy Theater during the Pittsburgh Cultural Trust Gallery Crawl on Friday, July 26th! We’re serving up FREE improv comedy shows every half hour from 6-10 PM. Beat the heat with some cool laughs in our A/C, and if you love it (which you will!), snag a discount on our 7 & 9 PM shows to keep the fun going. See you there for a comedy-packed evening!","943 Liberty Ave, Pittsburgh, PA 15222",Arcade Comedy Theater,
Peter Pan,Arts + Culture,Oct,25,2024,Oct,25.0,2024.0,7:30 pm,10:30 pm,"Escape to Neverland for a daring adventure with Wendy, John, Michael, Tinkerbell and Peter in the ever-playful Peter Pan.","7th St and Penn Ave, Pittsburgh, PA 15222",Benedum Center,
Night Market,Outdoor,Oct,25,2024,Oct,25.0,2024.0,4:00 pm,9:00 pm,"Night Markets bring an awesome outdoor pop-up shopping market and festival to Downtown, featuring Pittsburgh’s most creative independent vendors. Clothing, furniture, candles, food, drinks, and more are exhibited in this weekly series.","Pittsburgh, PA 15222",Market Square,
Let’s Speak English!,Community,Oct,25,2024,Oct,25.0,2024.0,12:00 pm,1:00 pm,"This is a relaxed, social discussion group where participants can freely practice their English-speaking skills with friendly neighbors. For English language learners looking to practice with other learners.","612 Smithfield St, Pittsburgh, PA 15222",Carnegie Library of Pittsburgh Downtown,
Moonlight Dance Cruise &amp; Tour,Nightlife,Oct,25,2024,Oct,25.0,2024.0,10:30 pm,1:30 am,"It’s time to party out on the water every Friday night this summer! DJ ROK is back on the boat with a mix of the best of today’s urban hits, hip-hop, rap, R&B, and old school jams. And enjoy a free Midnight Buffet!   Must be 21 years of age. Valid photo ID required.","350 West Station Square Dr, Pittsburgh, PA 15219",Gateway Clipper Fleet Docks,
Coffee + Connect,Community,Oct,25,2024,Oct,25.0,2024.0,10:00 am,11:00 am,Join us to enjoy some coffee and snacks and meet a representative from a local community organization to learn more about their services.,"612 Smithfield St, Pittsburgh, PA 15222",Carnegie Library of Pittsburgh Downtown,
Lit Friday: Mecca Jamilah Sullivan,Arts + Culture,Oct,25,2024,Oct,25.0,2024.0,6:00 pm,7:00 pm,Mecca Jamilah Sullivan joins LIT Friday to discuss WE ARE A HAUNTING.,,Virtual Event,
Monster's Ball,Holidays,Oct,26,2024,Oct,26.0,2024.0,10:00 pm,2:00 am,A Halloween Costume Party at Social House!,"123 7th St, Pittsburgh, PA 15222",Social House,
2024 ATA Fall Nationals Tournament,Convention,Oct,25,2024,Oct,26.0,2024.0,,,Athletes will compete through the ATA Fall National 2024.,"1000 Fort Dusquene Boulevard, Pittsburgh, PA 15222",David L. Lawrence Convention Center,
Boo N Brew Dance Cruise &amp; Tour,Nightlife,Oct,26,2024,Oct,26.0,2024.0,6:00 pm,10:30 pm,"Join us on the dock starting at 6:00 pm for free psychic and tarot card readings, prizes and mingle with your favorite BOB FM on air personalities. At 8 pm, the party hits the water with the band “Random Play” playing all your favorites hits – 96.9 BOB FM style! Don’t forget to wear your Halloween costumes for your chance to win great prizes including concert and event tickets, and a fantastic grand prize to be announced!","350 West Station Square Dr, Pittsburgh, PA 15219",Gateway Clipper Fleet Docks,
Daisy Dukes &amp; Cowboy Boots Tour with TVBOO,Entertainment,Oct,26,2024,Oct,26.0,2024.0,7:00 pm,11:00 pm,"With special guests TVBOO, Shlump, smith., and Mport!","400 N Shore Dr, Pittsburgh, PA 15212",Stage AE,
Fitness Open House,Community,Oct,26,2024,Oct,26.0,2024.0,10:00 am,1:00 pm,Join River Club for their 2nd Annual Fitness Open House!,"301 Grant St Ste 411, Pittsburgh, PA 15219",Rivers Club,
SkyWatch,Community,Oct,26,2024,Oct,26.0,2024.0,9:00 pm,11:00 pm,"Stargaze a Saturday night away. Reconnect with the night sky through a featured planetarium performance and, weather-permitting, live views of night sky objects in telescopic detail.","1 Allegheny Ave, Pittsburgh, PA 15212",Carnegie Science Center,
Mike Super - Magic &amp; Illusion,Entertainment,Oct,26,2024,Oct,26.0,2024.0,7:00 pm,8:30 pm,Experience the Magic & Illusion of Mike Super LIVE on Stage! This is the perfect evening for your entire family!,"101 6th St, Pittsburgh, PA 15222",Byham Theater,
Knights of the Arcade: Epic D&amp;D Adventure,Entertainment,Oct,26,2024,Oct,26.0,2024.0,9:00 pm,11:00 pm,"Join Knights of the Arcade on Saturday, August 31, at 9 PM for another hilarious D&D comedy adventure! One of Pittsburgh’s longest running and best-selling comedy shows! A recurring cast of characters are joined by special guests and led by their maniacal dungeon master. Where they’re going, who they fight, and if they ultimately succeed is decided upon live dice that are rolled and projected on the theater wall.","943 Liberty Ave, Pittsburgh, PA 15222",Arcade Comedy Theater,
Beta Stage,Entertainment,Oct,26,2024,Oct,26.0,2024.0,6:00 pm,8:00 pm,"Join us monthly as we showcase new and experimental acts, returning teams, and new ideas by familiar favorites! See the Arcade shows of tomorrow TODAY*","943 Liberty Ave, Pittsburgh, PA 15222",Arcade Comedy Theater,
Pittsburgh Riverhounds SC vs. El Paso Locomotive,Sports + Recreation,Oct,26,2024,Oct,26.0,2024.0,7:00 pm,10:00 pm,Come cheer on the Pittsburgh Riverhounds as they take on El Paso Locomotive!,"510 W Station Square Dr, Pittsburgh, PA 15219",Highmark Stadium,
Night Market,Outdoor,Oct,26,2024,Oct,26.0,2024.0,4:00 pm,9:00 pm,"Night Markets bring an awesome outdoor pop-up shopping market and festival to Downtown, featuring Pittsburgh’s most creative independent vendors. Clothing, furniture, candles, food, drinks, and more are exhibited in this weekly series.","Pittsburgh, PA 15222",Market Square,
Harry Potter and the Order of the Phoenix™ in Concert,Entertainment,Oct,26,2024,Oct,26.0,2024.0,7:00 pm,11:00 pm,Experience your favorite movies transformed with the music of a live symphony orchestra in the Harry Potter™ Film Concert Series.?,"600 Penn Ave, Pittsburgh, PA 15222",Heinz Hall,
Black &amp; Gold Tour,Tours,Oct,26,2024,Oct,26.0,2024.0,12:00 pm,1:30 pm,"Hop aboard and see the Steel City like never before on this one-of-a-kind, tailgate style tour… only in THE BURGH!","2101 Smallman St, Pittsburgh, PA 15222",Boarding,
Pittsburgh Steelers vs. New York Giants,Entertainment,Oct,28,2024,Oct,28.0,2024.0,8:00 pm,11:30 pm,The Pittsburgh Steelers take on the in 2024 NFL Regular Season Football action at Acrisure Stadium.,"100 Art Rooney Ave, Pittsburgh, PA 15212",Acrisure Stadium,
Marcario Film Screening,Film &amp; Movies,Oct,29,2024,Oct,31.0,2024.0,,,Join the Pittsburgh Cultural Trust to celebrate Día de Los Muertos!,"809 Liberty Ave, Pittsburgh, PA 15222",Harris Theater,
Pittsburgh Steelers vs. New York Giants,Outdoor,Oct,28,2024,Oct,28.0,2024.0,8:00 pm,11:30 pm,The Pittsburgh Steelers take on the 2024 NFL Regular Season Football action at Acrisure Stadium.,"100 Art Rooney Avenue, Pittsburgh, PA 15212",Acrirsure Stadium,
Trick-or-Treat at Museum of Illusions,Community,Oct,28,2024,Oct,31.0,2024.0,,,"From Monday, October 28 to Thursday, October 31, 2024, kids can get a head start on trick-or-treating at the Museum during regular operating hours.","267 N Shore Dr, Pittsburgh, PA 15212",Museum of Illusions,
Cavetown,Entertainment,Oct,29,2024,Oct,29.0,2024.0,7:00 pm,11:00 pm,With special guest Frankie Cosmos!,"400 N Shore Dr, Pittsburgh, PA 15212",Stage AE,
Storytime Spotlight,Arts + Culture,Oct,29,2024,Oct,29.0,2024.0,6:30 pm,7:30 pm,"Storytime Spotlight is an educational series presented by the August Wilson African American Cultural Center that introduces young children to books that features stories, songs, rhymes, and fingerplays.",,Virutal Event,
Penguins vs. Wild,Sports + Recreation,Oct,29,2024,Oct,29.0,2024.0,7:30 pm,10:30 pm,Come cheer on the Penguins as they take on the Wild at PPG Paints Arena!,"1001 Fifth Ave, Pittsburgh, PA 15219",PPG Paints Arena,
Creative Conversations — &amp; Juliet,Arts + Culture,Oct,30,2024,Oct,30.0,2024.0,6:30 pm,7:30 pm,Join Trust Arts Education for a pre-show chat on Wednesday nights with members from the company (schedule permitting) hosted by local theatre professionals to learn insights into the show you can’t find in your playbill.,"807 Liberty Ave, Pittsburgh, PA 15222",Trust Arts Education Center,
Día de los Muertos Lunch Event,Community,Oct,30,2024,Oct,30.0,2024.0,12:00 pm,1:30 pm,"Celebrate the flavors of Mexican and Latin cuisine with a food truck round-up featuring local vendors. Enjoy delicious tacos, tamales, and more while being serenaded by Mariachi International’s live music, bringing the heart of the celebration to life through music and food.","149 8th St, Pittsburgh, PA 15222",The Backyard,
'Marcario' Film Screening,Film &amp; Movies,Oct,31,2024,Oct,31.0,2024.0,5:30 pm,7:00 pm,The Pittsburgh Cultural Trust celebrates Dia de los Muertos: Macario (1960),"809 Liberty Ave, Pittsburgh, PA 15222",Harris Theater,
California Golden Bears at Pittsburgh Panthers Basketball,,Jan,1,2025,,,,1:00 PM,,,"15261, Pittsburgh, Pennsylvania, US",Petersen Events Center,27.0
Louisville Cardinals at Pittsburgh Panthers Basketball,,Jan,1,2025,,,,1:00 PM,,,"15261, Pittsburgh, Pennsylvania, US",Petersen Events Center,250.0
Syracuse Orange at Pittsburgh Panthers Basketball,,Jan,2,2025,,,,1:00 PM,,,"15261, Pittsburgh, Pennsylvania, US",Petersen Events Center,200.0
North Carolina Tar Heels at Pittsburgh Panthers Basketball,,Jan,3,2025,,,,1:00 PM,,,"15261, Pittsburgh, Pennsylvania, US",Petersen Events Center,500.0
Robert Morris University Colonials Womens Hockey,,Jan,3,2025,,,,7:00 PM,,,"15225, Pittsburgh, Pennsylvania, US",Colonials Arena - RMU,28.0
Robert Morris University Colonials Womens Hockey,,Jan,3,2025,,,,7:00 PM,,,"15225, Pittsburgh, Pennsylvania, US",Clearview Arena (Formerly RMU Island Sports Center),12.0
Stanford Cardinal at Pittsburgh Panthers Basketball,,Jan,4,2025,,,,1:00 PM,,,"15261, Pittsburgh, Pennsylvania, US",Petersen Events Center,40.0
Boston College Eagles at Pittsburgh Panthers Basketball,,Jan,4,2025,,,,1:00 PM,,,"15261, Pittsburgh, Pennsylvania, US",Petersen Events Center,150.0
Robert Morris University Colonials Womens Hockey,,Jan,4,2025,,,,3:00 PM,,,"15225, Pittsburgh, Pennsylvania, US",Colonials Arena - RMU,12.0
Robert Morris University Colonials Womens Hockey,,Jan,4,2025,,,,3:00 PM,,,"15225, Pittsburgh, Pennsylvania, US",Clearview Arena (Formerly RMU Island Sports Center),24.0
Premium Tailgate Party: Cincinnati Bengal at Pittsburgh Steelers,,Jan,5,2025,,,,1:00 PM,,,"15233, Pittsburgh, Pennsylvania, US",Premium Tailgate Tent - Pittsburgh (InActive),60.0
California Golden Bears at Pittsburgh Panthers Basketball,,Jan,5,2025,,,,1:00 PM,,,"15261, Pittsburgh, Pennsylvania, US",Petersen Events Center,150.0
Cincinnati Bengals at Pittsburgh Steelers,,Jan,5,2025,,,,1:00 PM,,,"15212, Pittsburgh, Pennsylvania, US",Acrisure Stadium (formerly Heinz Field),73.0
Clemson Tigers at Pittsburgh Panthers Basketball,,Jan,6,2025,,,,1:00 PM,,,"15261, Pittsburgh, Pennsylvania, US",Petersen Events Center,150.0
Georgia Tech Yellow Jackets at Pittsburgh Panthers Basketball,,Jan,7,2025,,,,1:00 PM,,,"15261, Pittsburgh, Pennsylvania, US",Petersen Events Center,150.0
Columbus Blue Jackets at Pittsburgh Penguins,,Jan,7,2025,,,,7:00 PM,,,"15219, Pittsburgh, Pennsylvania, US",PPG Paints Arena,40.0
Funny Girl,,Jan,7,2025,,,,7:30 PM,,,"15222, Pittsburgh, Pennsylvania, US",Benedum Center,82.0
Saint Joseph’s Hawks at Duquesne Dukes Basketball,,Jan,8,2025,,,,1:00 PM,,,"15282, Pittsburgh, Pennsylvania, US",UPMC Cooper Fieldhouse,17.0
Miami Hurricanes at Pittsburgh Panthers Basketball,,Jan,8,2025,,,,1:00 PM,,,"15261, Pittsburgh, Pennsylvania, US",Petersen Events Center,200.0
Saint Joseph’s Hawks at Duquesne Dukes Basketball,,Jan,8,2025,,,,7:00 PM,,,"15282, Pittsburgh, Pennsylvania, US",UPMC Cooper Fieldhouse,16.0
Funny Girl,,Jan,8,2025,,,,7:30 PM,,,"15222, Pittsburgh, Pennsylvania, US",Benedum Center,88.0
Stanford Cardinal at Pittsburgh Panthers Basketball,,Jan,9,2025,,,,1:00 PM,,,"15261, Pittsburgh, Pennsylvania, US",Petersen Events Center,150.0
Phil Hanley Spellbound Tour,,Jan,9,2025,,,,7:00 PM,,,"15120, Pittsburgh, Pennsylvania, US",Pittsburgh Improv,51.0
Edmonton Oilers at Pittsburgh Penguins,,Jan,9,2025,,,,7:00 PM,,,"15219, Pittsburgh, Pennsylvania, US",PPG Paints Arena,50.0
Funny Girl,,Jan,9,2025,,,,7:30 PM,,,"15222, Pittsburgh, Pennsylvania, US",Benedum Center,88.0
Virginia Cavaliers at Pittsburgh Panthers Basketball,,Jan,10,2025,,,,1:00 PM,,,"15261, Pittsburgh, Pennsylvania, US",Petersen Events Center,200.0
Phil Hanley Spellbound Tour,,Jan,10,2025,,,,7:00 PM,,,"15120, Pittsburgh, Pennsylvania, US",Pittsburgh Improv,52.0
Paradise The Ultimate Eddie Money Tribute,,Jan,10,2025,,,,7:00 PM,,,"15219, Pittsburgh, PA, US",Hard Rock Cafe Pittsburgh,33.0
Funny Girl,,Jan,10,2025,,,,7:30 PM,,,"15222, Pittsburgh, Pennsylvania, US",Benedum Center,88.0
Pittsburgh Symphony Orchestra – Debussy’s La Mer,,Jan,10,2025,,,,7:30 PM,,,"15222, Pittsburgh, PA, US",Heinz Hall,276.0
San Francisco Giants at Pittsburgh Pirates,,Aug,4,2025,,,,1:00 PM,,,"15212, Pittsburgh, Pennsylvania, US",PNC Park,25.0
San Francisco Giants at Pittsburgh Pirates,,Aug,5,2025,,,,1:00 PM,,,"15212, Pittsburgh, Pennsylvania, US",PNC Park,25.0
San Francisco Giants at Pittsburgh Pirates,,Aug,6,2025,,,,1:00 PM,,,"15212, Pittsburgh, Pennsylvania, US",PNC Park,25.0
Cincinnati Reds at Pittsburgh Pirates,,Aug,7,2025,,,,1:00 PM,,,"15212, Pittsburgh, Pennsylvania, US",PNC Park,25.0
Cincinnati Reds at Pittsburgh Pirates,,Aug,8,2025,,,,1:00 PM,,,"15212, Pittsburgh, Pennsylvania, US",PNC Park,25.0
Cincinnati Reds at Pittsburgh Pirates,,Aug,9,2025,,,,1:00 PM,,,"15212, Pittsburgh, Pennsylvania, US",PNC Park,25.0
Cincinnati Reds at Pittsburgh Pirates,,Aug,10,2025,,,,1:00 PM,,,"15212, Pittsburgh, Pennsylvania, US",PNC Park,25.0
Toronto Blue Jays at Pittsburgh Pirates,,Aug,18,2025,,,,1:00 PM,,,"15212, Pittsburgh, Pennsylvania, US",PNC Park,25.0
Toronto Blue Jays at Pittsburgh Pirates,,Aug,19,2025,,,,1:00 PM,,,"15212, Pittsburgh, Pennsylvania, US",PNC Park,40.0
Toronto Blue Jays at Pittsburgh Pirates,,Aug,20,2025,,,,1:00 PM,,,"15212, Pittsburgh, Pennsylvania, US",PNC Park,25.0
Colorado Rockies at Pittsburgh Pirates,,Aug,22,2025,,,,1:00 PM,,,"15212, Pittsburgh, Pennsylvania, US",PNC Park,40.0
Colorado Rockies at Pittsburgh Pirates,,Aug,23,2025,,,,1:00 PM,,,"15212, Pittsburgh, Pennsylvania, US",PNC Park,25.0
Colorado Rockies at Pittsburgh Pirates,,Aug,24,2025,,,,1:00 PM,,,"15212, Pittsburgh, Pennsylvania, US",PNC Park,25.0
Texas Tailgaters at Savannah Bananas,,Aug,29,2025,,,,1:00 PM,,,"15212, Pittsburgh, Pennsylvania, US",PNC Park,318.0
Texas Tailgaters at Savannah Bananas,,Aug,30,2025,,,,1:00 PM,,,"15212, Pittsburgh, Pennsylvania, US",PNC Park,318.0
George Mason Patriots at Duquesne Dukes Basketball,,Mar,1,2025,,,,1:00 PM,,,"15282, Pittsburgh, Pennsylvania, US",UPMC Cooper Fieldhouse,17.0
Boston Bruins at Pittsburgh Penguins,,Mar,1,2025,,,,3:00 PM,,,"15219, Pittsburgh, Pennsylvania, US",PPG Paints Arena,80.0
Pittsburgh Symphony Orchestra,,Mar,1,2025,,,,7:30 PM,,,"15222, Pittsburgh, PA, US",Heinz Hall,43.0
Ashley Cooke,,Mar,1,2025,,,,8:00 PM,,,"15212, Pittsburgh, PA, US",Stage AE,34.0
Toronto Maple Leafs at Pittsburgh Penguins,,Mar,2,2025,,,,1:00 PM,,,"15219, Pittsburgh, Pennsylvania, US",PPG Paints Arena,71.0
Pittsburgh Symphony Orchestra – Pixar in Concert,,Mar,2,2025,,,,2:30 PM,,,"15222, Pittsburgh, PA, US",Heinz Hall,264.0
Virginia Commonwealth Rams at Duquesne Dukes Basketball,,Mar,4,2025,,,,1:00 PM,,,"15282, Pittsburgh, Pennsylvania, US",UPMC Cooper Fieldhouse,20.0
Kimberly Akimbo,,Mar,4,2025,,,,7:30 PM,,,"15222, Pittsburgh, Pennsylvania, US",Benedum Center,215.0
Kimberly Akimbo,,Mar,5,2025,,,,7:30 PM,,,"15222, Pittsburgh, Pennsylvania, US",Benedum Center,215.0
Sheng Wang,,Mar,6,2025,,,,7:30 PM,,,"15120, Pittsburgh, Pennsylvania, US",Carnegie of Homestead Music Hall,119.0
Kimberly Akimbo,,Mar,6,2025,,,,7:30 PM,,,"15222, Pittsburgh, Pennsylvania, US",Benedum Center,215.0
Pittsburgh Symphony Orchestra – Mozart and Prokofiev’s Fifth,,Mar,7,2025,,,,7:30 PM,,,"15222, Pittsburgh, PA, US",Heinz Hall,264.0
Kimberly Akimbo,,Mar,7,2025,,,,7:30 PM,,,"15222, Pittsburgh, Pennsylvania, US",Benedum Center,136.0
Kimberly Akimbo,,Mar,8,2025,,,,2:01 PM,,,"15222, Pittsburgh, Pennsylvania, US",Benedum Center,120.0
Boston College Eagles at Pittsburgh Panthers Basketball,,Mar,8,2025,,,,6:00 PM,,,"15261, Pittsburgh, Pennsylvania, US",Petersen Events Center,35.0
Pittsburgh Symphony Orchestra,,Mar,8,2025,,,,7:00 PM,,,"15222, Pittsburgh, PA, US",Heinz Hall,264.0
Kimberly Akimbo,,Mar,8,2025,,,,7:30 PM,,,"15222, Pittsburgh, Pennsylvania, US",Benedum Center,75.0
Kimberly Akimbo,,Mar,9,2025,,,,1:00 PM,,,"15222, Pittsburgh, Pennsylvania, US",Benedum Center,128.0
Pittsburgh Symphony Orchestra – Mozart and Prokofiev’s Fifth,,Mar,9,2025,,,,2:30 PM,,,"15222, Pittsburgh, PA, US",Heinz Hall,264.0
Kimberly Akimbo,,Mar,9,2025,,,,6:30 PM,,,"15222, Pittsburgh, Pennsylvania, US",Benedum Center,215.0
Vegas Golden Knights at Pittsburgh Penguins,,Mar,11,2025,,,,7:00 PM,,,"15219, Pittsburgh, Pennsylvania, US",PPG Paints Arena,45.0
St. Louis Blues at Pittsburgh Penguins,,Mar,13,2025,,,,7:00 PM,,,"15219, Pittsburgh, Pennsylvania, US",PPG Paints Arena,47.0
New Jersey Devils at Pittsburgh Penguins,,Mar,15,2025,,,,3:00 PM,,,"15219, Pittsburgh, Pennsylvania, US",PPG Paints Arena,87.0
Alton Brown: Last Bite,,Mar,16,2025,,,,7:30 PM,,,"15222, Pittsburgh, Pennsylvania, US",Benedum Center,70.0
Quicksand (18+ Event),,Mar,16,2025,,,,8:00 PM,,,"15201, Pittsburgh, PA, US",Cafe at Thunderbird Cafe &amp; Music Hall,53.0
Quicksand,,Mar,16,2025,,,,8:00 PM,,,"15201, Pittsburgh, Pennsylvania, US",Music Hall at Thunderbird Café &amp; Music Hall,71.0
Foil Arms and Hog,,Mar,16,2025,,,,8:00 PM,,,"15120, Pittsburgh, Pennsylvania, US",Carnegie of Homestead Music Hall,85.0
New York Islanders at Pittsburgh Penguins,,Mar,18,2025,,,,7:00 PM,,,"15219, Pittsburgh, Pennsylvania, US",PPG Paints Arena,39.0
Lang Lang,,Mar,19,2025,,,,7:30 PM,,,"15222, Pittsburgh, PA, US",Heinz Hall,250.0
Columbus Blue Jackets at Pittsburgh Penguins,,Mar,21,2025,,,,7:00 PM,,,"15219, Pittsburgh, Pennsylvania, US",PPG Paints Arena,60.0
St. Louis Cardinals at Pittsburgh Pirates,,Jul,1,2025,,,,1:00 PM,,,"15212, Pittsburgh, Pennsylvania, US",PNC Park,25.0
St. Louis Cardinals at Pittsburgh Pirates,,Jul,2,2025,,,,1:00 PM,,,"15212, Pittsburgh, Pennsylvania, US",PNC Park,25.0
Chicago White Sox at Pittsburgh Pirates,,Jul,18,2025,,,,1:00 PM,,,"15212, Pittsburgh, Pennsylvania, US",PNC Park,40.0
Chicago White Sox at Pittsburgh Pirates,,Jul,19,2025,,,,1:00 PM,,,"15212, Pittsburgh, Pennsylvania, US",PNC Park,25.0
Chicago White Sox at Pittsburgh Pirates,,Jul,20,2025,,,,1:00 PM,,,"15212, Pittsburgh, Pennsylvania, US",PNC Park,25.0
Detroit Tigers at Pittsburgh Pirates,,Jul,21,2025,,,,1:00 PM,,,"15212, Pittsburgh, Pennsylvania, US",PNC Park,25.0
Detroit Tigers at Pittsburgh Pirates,,Jul,22,2025,,,,1:00 PM,,,"15212, Pittsburgh, Pennsylvania, US",PNC Park,25.0
